<?xml version="1.0" encoding="UTF-8" standalone="no" ?>
<breakpoints xmlns:xsi="http://www.w3.org/2001/XMLSchema-instance" xsi:noNamespaceSchemaLocation="breakpoints.xsd">

  <breakpoint type="AET">
    <property>
      <name>Hardware Configuration</name>
      <property>
        <name>Type</name>
        <string>Trace</string>
        <property>
          <name>Trace Type</name>
          <string>Standard</string>
        </property>
        <property>
          <name>Actions</name>
          <string>User Script</string>
          <property>
            <name>Script Type</name>
            <string>Statistical Profile</string>
            <property>
              <name>Cycle Count</name>
              <integer>1000</integer>
            </property>
          </property>
        </property>
      </property>
    </property>
    <property>
      <name>Miscellaneous</name>
      <property>
        <name>Group</name>
        <string>Default Group</string>
      </property>
      <property>
        <name>Name</name>
        <string>Statistical Function Profiling</string>
      </property>
    </property>
    <enabled>0</enabled>
  </breakpoint>

</breakpoints>
