<?xml version="1.0" encoding="UTF-8" standalone="no" ?>
<breakpoints xmlns:xsi="http://www.w3.org/2001/XMLSchema-instance"
	xsi:noNamespaceSchemaLocation="breakpoints.xsd">

	<breakpoint type="AET">
		<property>
			<name>Hardware Configuration</name>
			<property>
				<name>Type</name>
				<string>Trace</string>
				<property>
					<name>Trace Type</name>
					<string>Event</string>
				</property>
				<property>
				  <name>Actions</name>
				  <string>End All Trace</string>
				</property>
				<property>
				  <name>Trigger Type</name>
				  <string>PC</string>
				  <property>
					<name>Location Type</name>
					<string>Point</string>
					<property>
					  <name>Location</name>
					  <location>
						<address>0</address>
						<page>0</page>
					  </location>
					</property>
				  </property>
				  <property>
					<name>Trigger Skip/Delay</name>
					<string>No</string>
				  </property>
				</property>
				<property>
					<name>Global Category</name>
					<string>Memory</string>
					<property>
						<name>Event 1</name>
						<string></string>
						<property>
							<name>L1P Read Hit</name>
							<boolean>0</boolean>
						</property>
						<property>
							<name>L1P Read Miss</name>
							<boolean>1</boolean>
							<property>
								<name>Hits L2 SRAM</name>
								<boolean>1</boolean>
							</property>
							<property>
								<name>Hits L2 Cache</name>
								<boolean>0</boolean>
							</property>
							<property>
								<name>Hits External</name>
								<boolean>0</boolean>
							</property>
						</property>
						<property>
							<name>L1D Read Hit Path A</name>
							<boolean>0</boolean>
						</property>
						<property>
							<name>L1D Read Hit Path B</name>
							<boolean>0</boolean>
						</property>
						<property>
							<name>L1D Write Hit Path A</name>
							<boolean>0</boolean>
						</property>
						<property>
							<name>L1D Write Hit Path B</name>
							<boolean>0</boolean>
						</property>
						<property>
							<name>L1D Read Miss Path A</name>
							<boolean>0</boolean>
						</property>
						<property>
							<name>L1D Read Miss Path B</name>
							<boolean>0</boolean>
						</property>
						<property>
							<name>L1D Write Miss Path A</name>
							<boolean>0</boolean>
						</property>
						<property>
							<name>L1D Write Miss Path B</name>
							<boolean>0</boolean>
						</property>
						<property>
							<name>Tag/Victim/Write Buf Flush A</name>
							<boolean>0</boolean>
						</property>
						<property>
							<name>Tag/Victim/Write Buf Flush B</name>
							<boolean>0</boolean>
						</property>
						<property>
							<name>CPU-CPU Bank Conflict</name>
							<boolean>0</boolean>
						</property>
						<property>
							<name>CPU-Snoop Conflict</name>
							<boolean>0</boolean>
						</property>
						<property>
							<name>CPU-IDMA/EDMA Bank Conflict</name>
							<boolean>0</boolean>
						</property>
					</property>
					<property>
						<name>Event 2</name>
						<string></string>
						<property>
							<name>L1P Read Hit</name>
							<boolean>0</boolean>
						</property>
						<property>
							<name>L1P Read Miss</name>
							<boolean>1</boolean>
							<property>
								<name>Hits L2 SRAM</name>
								<boolean>0</boolean>
							</property>
							<property>
								<name>Hits L2 Cache</name>
								<boolean>1</boolean>
							</property>
							<property>
								<name>Hits External</name>
								<boolean>0</boolean>
							</property>
						</property>
						<property>
							<name>L1D Read Hit Path A</name>
							<boolean>0</boolean>
						</property>
						<property>
							<name>L1D Read Hit Path B</name>
							<boolean>0</boolean>
						</property>
						<property>
							<name>L1D Write Hit Path A</name>
							<boolean>0</boolean>
						</property>
						<property>
							<name>L1D Write Hit Path B</name>
							<boolean>0</boolean>
						</property>
						<property>
							<name>L1D Read Miss Path A</name>
							<boolean>0</boolean>
						</property>
						<property>
							<name>L1D Read Miss Path B</name>
							<boolean>0</boolean>
						</property>
						<property>
							<name>L1D Write Miss Path A</name>
							<boolean>0</boolean>
						</property>
						<property>
							<name>L1D Write Miss Path B</name>
							<boolean>0</boolean>
						</property>
						<property>
							<name>Tag/Victim/Write Buf Flush A</name>
							<boolean>0</boolean>
						</property>
						<property>
							<name>Tag/Victim/Write Buf Flush B</name>
							<boolean>0</boolean>
						</property>
						<property>
							<name>CPU-CPU Bank Conflict</name>
							<boolean>0</boolean>
						</property>
						<property>
							<name>CPU-Snoop Conflict</name>
							<boolean>0</boolean>
						</property>
						<property>
							<name>CPU-IDMA/EDMA Bank Conflict</name>
							<boolean>0</boolean>
						</property>
					</property>
					<property>
						<name>Event 3</name>
						<string></string>
						<property>
							<name>L1P Read Hit</name>
							<boolean>0</boolean>
						</property>
						<property>
							<name>L1P Read Miss</name>
							<boolean>1</boolean>
							<property>
								<name>Hits L2 SRAM</name>
								<boolean>0</boolean>
							</property>
							<property>
								<name>Hits L2 Cache</name>
								<boolean>0</boolean>
							</property>
							<property>
								<name>Hits External</name>
								<boolean>1</boolean>
							</property>
						</property>
						<property>
							<name>L1D Read Hit Path A</name>
							<boolean>0</boolean>
						</property>
						<property>
							<name>L1D Read Hit Path B</name>
							<boolean>0</boolean>
						</property>
						<property>
							<name>L1D Write Hit Path A</name>
							<boolean>0</boolean>
						</property>
						<property>
							<name>L1D Write Hit Path B</name>
							<boolean>0</boolean>
						</property>
						<property>
							<name>L1D Read Miss Path A</name>
							<boolean>0</boolean>
						</property>
						<property>
							<name>L1D Read Miss Path B</name>
							<boolean>0</boolean>
						</property>
						<property>
							<name>L1D Write Miss Path A</name>
							<boolean>0</boolean>
						</property>
						<property>
							<name>L1D Write Miss Path B</name>
							<boolean>0</boolean>
						</property>
						<property>
							<name>Tag/Victim/Write Buf Flush A</name>
							<boolean>0</boolean>
						</property>
						<property>
							<name>Tag/Victim/Write Buf Flush B</name>
							<boolean>0</boolean>
						</property>
						<property>
							<name>CPU-CPU Bank Conflict</name>
							<boolean>0</boolean>
						</property>
						<property>
							<name>CPU-Snoop Conflict</name>
							<boolean>0</boolean>
						</property>
						<property>
							<name>CPU-IDMA/EDMA Bank Conflict</name>
							<boolean>0</boolean>
						</property>
					</property>
					<property>
						<name>Event 4</name>
						<string></string>
						<property>
							<name>L1P Read Hit</name>
							<boolean>0</boolean>
						</property>
						<property>
							<name>L1P Read Miss</name>
							<boolean>0</boolean>
						</property>
						<property>
							<name>L1D Read Hit Path A</name>
							<boolean>0</boolean>
						</property>
						<property>
							<name>L1D Read Hit Path B</name>
							<boolean>0</boolean>
						</property>
						<property>
							<name>L1D Write Hit Path A</name>
							<boolean>0</boolean>
						</property>
						<property>
							<name>L1D Write Hit Path B</name>
							<boolean>0</boolean>
						</property>
						<property>
							<name>L1D Read Miss Path A</name>
							<boolean>0</boolean>
						</property>
						<property>
							<name>L1D Read Miss Path B</name>
							<boolean>0</boolean>
						</property>
						<property>
							<name>L1D Write Miss Path A</name>
							<boolean>0</boolean>
						</property>
						<property>
							<name>L1D Write Miss Path B</name>
							<boolean>0</boolean>
						</property>
						<property>
							<name>Tag/Victim/Write Buf Flush A</name>
							<boolean>0</boolean>
						</property>
						<property>
							<name>Tag/Victim/Write Buf Flush B</name>
							<boolean>0</boolean>
						</property>
						<property>
							<name>CPU-CPU Bank Conflict</name>
							<boolean>0</boolean>
						</property>
						<property>
							<name>CPU-Snoop Conflict</name>
							<boolean>0</boolean>
						</property>
						<property>
							<name>CPU-IDMA/EDMA Bank Conflict</name>
							<boolean>0</boolean>
						</property>
					</property>
					<property>
						<name>Advanced</name>
						<string></string>
						<property>
							<name>Encoding Mode</name>
							<string>Generic</string>
						</property>
					</property>
				</property>
			</property>
		</property>
		<property>
			<name>Miscellaneous</name>
			<property>
				<name>Group</name>
				<string>Default Group</string>
			</property>
			<property>
				<name>Name</name>
				<string>Cache Analysis - End All</string>
			</property>
		</property>
		<enabled>0</enabled>
	</breakpoint>

</breakpoints>
