<?xml version="1.0" encoding="UTF-8" standalone="no" ?>
<breakpoints xmlns:xsi="http://www.w3.org/2001/XMLSchema-instance" xsi:noNamespaceSchemaLocation="breakpoints.xsd">

  <breakpoint type="AET">
    <property>
      <name>Hardware Configuration</name>
      <property>
        <name>Type</name>
        <string>Trace</string>
        <property>
          <name>STM Trace Type</name>
          <string>System Event Detection(EVE3)</string>
          <property>
            <name>Signal Type</name>
            <string>Low Level</string>
          </property>
          <property>
            <name>Msg Generation Type</name>
            <string>in Sampling Window</string>
            <property>
              <name>Sampling Window(cycles)</name>
              <integer>255</integer>
            </property>
          </property>
          <property>
            <name>Start on Ext. Trigger</name>
            <boolean>0</boolean>
          </property>
          <property>
            <name>Stop on Ext. Trigger</name>
            <boolean>0</boolean>
          </property>
          <property>
            <name>Event Selection</name>
            <string></string>
            <property>
              <name>tpcc_aet_start</name>
              <boolean>1</boolean>
            </property>
            <property>
              <name>tpcc_aet_stop</name>
              <boolean>1</boolean>
            </property>
            <property>
              <name>ARP32 Int4</name>
              <boolean>1</boolean>
            </property>
            <property>
              <name>ARP32 Int5</name>
              <boolean>1</boolean>
            </property>
            <property>
              <name>ARP32 Int6</name>
              <boolean>1</boolean>
            </property>
            <property>
              <name>ARP32 Int7</name>
              <boolean>1</boolean>
            </property>
            <property>
              <name>VCOP Loop Start</name>
              <boolean>1</boolean>
            </property>
            <property>
              <name>VCOP Done</name>
              <boolean>1</boolean>
            </property>
            <property>
              <name>ARP32 NMI</name>
              <boolean>1</boolean>
            </property>
          </property>
        </property>
      </property>
    </property>
    <property>
      <name>Miscellaneous</name>
      <property>
        <name>Group</name>
        <string>Default Group</string>
      </property>
      <property>
        <name>Name</name>
        <string>SMSET EVE3</string>
      </property>
    </property>
    <enabled>1</enabled>
  </breakpoint>

</breakpoints>
